Category,Document
Economics,"The government has unveiled a new stimulus package aimed at boosting economic growth. This package includes tax incentives, infrastructure projects, and direct financial aid to businesses and individuals affected by the pandemic."
Economics,"Global oil prices have surged to new highs due to ongoing supply chain disruptions and geopolitical tensions. The increased prices are expected to impact various sectors, including transportation and manufacturing."
Economics,"In a bid to combat rising inflation, the central bank has announced an increase in interest rates. This move is aimed at stabilizing the economy and curbing consumer prices."
Economics,"Tech companies have reported record profits as the pandemic drives increased demand for digital services and products. Companies in the sector are seeing significant growth in revenue and market share."
Economics,"A new trade agreement has been signed between major economies, aiming to reduce tariffs and promote international trade. This agreement is expected to benefit multiple industries by facilitating smoother cross-border transactions."
Economics,"The housing market continues to see a significant increase in home prices, driven by high demand and low supply. This trend is particularly noticeable in urban areas, where the competition for properties is fierce."
Economics,"The unemployment rate has dropped as the economy begins to recover from the pandemic. More people are returning to work, and businesses are ramping up hiring to meet growing consumer demand."
Economics,"The government has launched a major infrastructure investment program designed to create jobs and stimulate economic growth. The program focuses on improving transportation networks, energy systems, and digital infrastructure."
Economics,"Retail sales have surged as consumer confidence improves, leading to increased spending on goods and services. This uptick is a positive sign for the economy as it recovers from the effects of the pandemic."
Economics,"The International Monetary Fund has forecasted global economic growth for 2022, citing recovery efforts and increased vaccination rates as key factors. However, uncertainties remain due to potential new variants of the virus."
Economics,"New tax legislation aims to provide relief for small businesses. The measures include lower tax rates and simplified reporting requirements to help businesses recover from the pandemic."
Economics,"Major airline industry players have reported financial losses due to travel restrictions. The ongoing impact of the pandemic continues to affect international and domestic travel."
Economics,"Global supply chain issues are impacting manufacturing industries worldwide. Delays and shortages are causing increased production costs and affecting delivery schedules."
Economics,"The stock market has experienced volatility amid economic uncertainty. Investors are reacting to mixed signals from economic data and geopolitical developments."
Economics,"Consumer spending has increased in response to easing lockdown measures. Retailers and service providers are seeing higher sales as people return to normal activities."
Economics,"The agricultural sector is facing challenges due to extreme weather events. Farmers are dealing with droughts, floods, and other climate-related disruptions to their operations."
Economics,"Tech industry leaders are calling for regulatory reforms to support innovation. They argue that outdated regulations are hindering progress in fields like artificial intelligence and biotechnology."
Economics,"Public-private partnerships have been announced to boost clean energy investments. These initiatives aim to accelerate the transition to renewable energy sources and reduce carbon emissions."
Economics,"Economic recovery is being seen in emerging markets as vaccination rates increase. Countries are experiencing growth in various sectors as they reopen and rebuild their economies."
Economics,"The government has introduced new policies to support sustainable development. These include incentives for green technologies and measures to protect natural resources."
Economics,"The banking sector is undergoing a digital transformation to enhance customer experience. Financial institutions are investing in new technologies to offer more convenient and efficient services."
Economics,"International trade volume has rebounded after a pandemic-induced decline. Businesses are ramping up exports and imports as global demand recovers."
Economics,"The government has outlined plans for economic diversification in oil-dependent regions. The aim is to reduce reliance on oil revenues and develop other sectors like tourism and manufacturing."
Economics,"Investors are showing growing interest in green bonds and sustainable finance. These financial instruments support environmentally friendly projects and initiatives."
Economics,"The economic outlook remains uncertain amid geopolitical tensions. Ongoing conflicts and trade disputes are affecting investor confidence and market stability."
Economics,"Corporate mergers and acquisitions are on the rise as companies seek growth opportunities. Businesses are looking to expand their market share and diversify their operations through strategic deals."
Economics,"New regulations have been introduced to address financial sector risks. These include stricter capital requirements and enhanced oversight to prevent future crises."
Economics,"The global tourism industry is beginning to recover as travel restrictions ease. Destinations are welcoming back tourists, and travel businesses are seeing increased bookings."
Economics,"The healthcare sector is seeing increased investment due to ongoing pandemic challenges. Companies are expanding capacity and developing new treatments to address COVID-19 and other health issues."
Economics,"The government is implementing measures to support renewable energy projects. These initiatives aim to reduce reliance on fossil fuels and promote sustainable energy sources."
Economics,"The consumer price index shows a significant increase in the cost of living. Rising prices for goods and services are putting pressure on household budgets."
Economics,"The startup ecosystem is receiving a boost from new venture capital funding. Investors are supporting innovative companies with the potential for high growth and impact."
Economics,"The education sector is adapting to remote learning with new technologies. Schools and universities are investing in digital tools to facilitate online instruction."
Economics,"Transportation infrastructure improvements have been announced to ease congestion. Projects include expanding road networks and upgrading public transit systems."
Economics,"The economic impact of climate change is becoming a growing concern for policymakers. Efforts are being made to mitigate risks and adapt to changing environmental conditions."
Economics,"The government has released its annual economic review, highlighting key achievements. The report covers progress in areas like employment, trade, and fiscal policy."
Economics,"Tech startups are receiving increased attention from investors and media. Innovative companies in fields like AI, fintech, and health tech are attracting significant funding."
Economics,"Financial markets are reacting to global economic policy changes and forecasts. Analysts are closely monitoring developments and adjusting their strategies accordingly."
Economics,"Economic disparities are being highlighted as recovery progresses unevenly. Certain regions and demographics are facing more significant challenges in rebounding from the pandemic."
Economics,"New economic sanctions have been imposed on countries with trade disputes. These measures are aimed at pressuring governments to resolve conflicts and comply with international agreements."
Economics,"The government is focusing on enhancing economic resilience through policy reforms. Efforts include diversifying the economy and improving infrastructure to withstand future shocks."
Entertainment,"The Oscars 2021 were filled with major wins and surprising upsets. Notable awards included Best Picture going to 'Nomadland' and Best Actor awarded to Anthony Hopkins for 'The Father.'"
Entertainment,"The new blockbuster film has broken box office records worldwide, drawing large crowds to theaters despite ongoing pandemic concerns. The film's success is attributed to its star-studded cast and high production values."
Entertainment,"The annual music awards celebrated the top artists and albums of the year, with major wins for artists like Billie Eilish and The Weeknd. The event also featured memorable performances by leading musicians."
Entertainment,"Streaming services have seen record growth in subscribers during the pandemic, as more people turn to digital entertainment while staying at home. Companies like Netflix and Disney+ are leading the way with extensive content libraries."
Entertainment,"A high-profile celebrity charity event has raised millions for various causes, including education, healthcare, and disaster relief. The event featured appearances by well-known actors, musicians, and public figures."
Entertainment,"A popular TV series has announced its final season, eliciting mixed reactions from fans. While some are saddened by the end, others are eager to see how the story concludes."
Entertainment,"The international film festival showcased a diverse range of global cinema, with films from different countries and cultures. The festival highlighted emerging filmmakers and unique storytelling styles."
Entertainment,"The music industry is experiencing a resurgence with the return of live concerts and festivals. Artists are excited to perform in front of audiences again, and fans are eager to attend live events."
Entertainment,"The high-profile wedding of a celebrity couple has made headlines across various media outlets. The event was attended by numerous celebrities and featured lavish decorations and performances."
Entertainment,"Virtual reality technology is gaining traction in the gaming and entertainment sectors, offering immersive experiences for users. Companies are investing in VR to enhance their product offerings and attract tech-savvy consumers."
Entertainment,"A new documentary series explores intriguing historical events, providing viewers with in-depth insights and analysis. The series has been praised for its educational value and engaging storytelling."
Entertainment,"Celebrity fashion trends are dominating social media and fashion magazines. Influencers and designers are showcasing the latest styles, setting new trends for the season."
Entertainment,"An award-winning actor has announced a new project and upcoming film release. The actor's previous work has garnered critical acclaim, and anticipation is high for the new venture."
Entertainment,"Broadway is returning with new shows and safety measures in place. The reopening is a significant step for the theater industry, which has been heavily impacted by the pandemic."
Entertainment,"A major gaming company has released a highly anticipated new video game, which has quickly become a best-seller. The game's advanced graphics and immersive gameplay have received positive reviews."
Entertainment,"A documentary on an influential figure has received critical acclaim. The film provides a detailed look at the individual's life and impact on society, resonating with audiences and critics alike."
Entertainment,"A celebrity chef's new cookbook has become a bestseller. The book features innovative recipes and cooking tips, appealing to both amateur and experienced cooks."
Entertainment,"A popular podcast is gaining traction with exclusive interviews and content. The show's unique approach and engaging hosts are attracting a growing audience."
Entertainment,"A new streaming platform has entered the market with competitive pricing and a diverse content library. The platform aims to challenge established players like Netflix and Hulu."
Entertainment,"The film industry is adapting to changing viewer habits with innovative distribution methods. Studios are experimenting with simultaneous releases in theaters and on streaming platforms."
Entertainment,"Celebrity endorsements and partnerships are boosting brand visibility. Companies are leveraging the influence of stars to promote their products and reach wider audiences."
Entertainment,"A new animated series is capturing the imagination of both kids and adults. The show's creative storyline and high-quality animation are drawing praise from viewers."
Entertainment,"A film studio has announced a sequel to a successful franchise. Fans are eagerly awaiting the continuation of the story, which has become a cultural phenomenon."
Entertainment,"A music festival is featuring a diverse lineup of artists and performers. The event celebrates different genres and showcases both established and emerging talents."
Entertainment,"A television network has launched a new reality show with high audience ratings. The show's unique concept and engaging participants are attracting a dedicated viewership."
Entertainment,"Celebrity social media activity is sparking viral trends and challenges. Stars are using their platforms to connect with fans and influence popular culture."
Entertainment,"A documentary series is highlighting major cultural events and figures. The series provides historical context and personal stories, offering a comprehensive look at significant moments in history."
Entertainment,"Fashion week is showcasing cutting-edge designs and emerging trends. Designers are presenting their latest collections to industry professionals and fashion enthusiasts."
Entertainment,"A new book adaptation has received praise from critics and audiences alike. The film stays true to the source material while adding visual and narrative enhancements."
Entertainment,"Virtual concerts and performances are gaining popularity amid pandemic restrictions. Artists are finding creative ways to connect with fans through digital platforms."
Entertainment,"Celebrity lifestyle changes are prompting media buzz and public interest. Changes in relationships, health, and personal projects are widely covered by entertainment news outlets."
Entertainment,"Major film awards are recognizing breakthrough performances and achievements. Newcomers and veterans alike are being celebrated for their contributions to the industry."
Entertainment,"A streaming service has announced its expansion into new international markets. The company aims to reach a global audience with its diverse content offerings."
Entertainment,"Celebrity fitness and wellness trends are influencing public health discussions. Stars are promoting various health regimens, diets, and mental wellness practices."
Entertainment,"An upcoming film release is generating buzz with teaser trailers and promotional events. The film's marketing campaign is building anticipation among fans and media."
Entertainment,"The music industry is exploring new genres and innovative sounds. Artists are experimenting with different styles and collaborating across genres to create unique music."
Entertainment,"Celebrity collaborations are leading to new product launches and endorsements. Brands are partnering with stars to create exclusive collections and campaigns."
Entertainment,"Virtual reality gaming experiences are continuing to evolve and captivate audiences. Developers are pushing the boundaries of technology to create immersive and interactive games."
Entertainment,"An award-winning director has announced their next major project. The director's previous films have been critically acclaimed, and there is high interest in the new project."
Entertainment,"A new television series is gaining a cult following and critical acclaim. The show's unique concept, strong writing, and compelling characters are attracting a dedicated fan base."
Entertainment,"High-profile celebrity interviews are offering insights into personal lives and careers. These interviews provide fans with a deeper understanding of the stars they admire."
Entertainment,"A documentary sheds light on important social issues and movements. The film's investigative approach and emotional storytelling are resonating with viewers."
Entertainment,"A streaming service is releasing exclusive content to attract new subscribers. The platform's original programming is designed to compete with established services like Netflix and Amazon Prime."
Entertainment,"Fashion and beauty trends are shifting as new influencers emerge. Social media platforms are playing a significant role in shaping consumer preferences and trends."
Politics,"The recent election results have led to significant changes in government leadership, with new officials taking office and promising various reforms. The shift in power is expected to impact domestic and foreign policies."
Politics,"New policy initiatives have been announced to address national security concerns, including measures to enhance cybersecurity and counter-terrorism efforts. The government is prioritizing these initiatives to safeguard the nation's interests."
Politics,"An international summit focused on climate change and global cooperation, bringing together world leaders to discuss strategies for reducing carbon emissions and promoting sustainable development."
Politics,"The legislative body is currently debating controversial new immigration laws, with strong opinions on both sides. The proposed laws aim to reform immigration policies and address issues such as border security and asylum procedures."
Politics,"A political scandal has erupted involving high-ranking officials, leading to widespread public outrage and calls for accountability. Investigations are underway to uncover the full extent of the misconduct."
Politics,"The government has implemented new social programs to support underserved communities, including initiatives to improve education, healthcare, and housing. These programs are part of a broader effort to reduce inequality."
Politics,"Diplomatic tensions are rising between major world powers, with disagreements over trade, security, and human rights. The situation is being closely monitored by the international community."
Politics,"Political activists have organized large-scale protests calling for democratic reforms and greater transparency in government. The demonstrations have attracted significant public support and media attention."
Politics,"New trade agreements have been signed to strengthen economic ties between nations, aiming to boost mutual trade and investment. These agreements are expected to create new opportunities for businesses and consumers."
Politics,"The judicial system is facing scrutiny over recent high-profile cases, with debates about judicial independence and fairness. Critics are calling for reforms to ensure justice and accountability."
Politics,"A political party has announced major leadership changes ahead of upcoming elections. The new leaders are expected to bring fresh perspectives and strategies to the campaign."
Politics,"The legislature has passed a significant healthcare reform bill, aiming to improve access to medical services and reduce costs. The bill includes provisions for expanding insurance coverage and investing in public health infrastructure."
Politics,"International aid efforts have been mobilized in response to global humanitarian crises. Governments and NGOs are working together to provide relief and support to affected populations."
Politics,"Controversial election laws have sparked debates about voting rights and access. Critics argue that the new laws may disenfranchise certain groups, while supporters claim they are necessary for election integrity."
Politics,"The government has introduced new legislation to address income inequality. The proposed measures include tax reforms, wage increases, and social welfare programs aimed at reducing poverty."
Politics,"Political leaders are meeting to discuss strategies for economic recovery. The focus is on creating jobs, stimulating growth, and supporting businesses affected by the pandemic."
Politics,"Public opinion is shifting on major political issues amid ongoing debates. Surveys indicate changing attitudes towards topics like climate change, healthcare, and immigration."
Politics,"Political campaigns are heating up as candidates vie for key positions. Campaign events, debates, and advertisements are intensifying as election day approaches."
Politics,"New transparency measures have been introduced to combat corruption. The government is implementing stricter regulations and oversight to ensure accountability in public and private sectors."
Politics,"The government is responding to international pressure on human rights issues. Efforts include reviewing policies, addressing violations, and cooperating with global organizations."
Politics,"The legislative body is tackling controversial environmental policies. Lawmakers are debating regulations aimed at reducing pollution, protecting natural resources, and combating climate change."
Politics,"Political leaders are calling for increased collaboration on global health initiatives. The focus is on addressing pandemics, improving healthcare access, and supporting research and development."
Politics,"Public protests have erupted over recent policy decisions, with demonstrators demanding changes and accountability. The protests are drawing attention to social and political issues affecting communities."
Politics,"Political parties are strategizing for upcoming local and national elections. Campaign teams are developing platforms, rallying supporters, and preparing for competitive races."
Politics,"The government is investing in public infrastructure to boost economic development. Projects include building roads, bridges, and public facilities to improve living standards and create jobs."
Politics,"Diplomatic relations are improving between historically adversarial countries. Recent talks and agreements are paving the way for increased cooperation and reduced tensions."
Politics,"The legislature is reviewing and revising budget allocations for key sectors. The aim is to ensure efficient use of resources and address the needs of different areas, such as education, healthcare, and defense."
Politics,"Political reform movements are gaining traction among young voters. Activists are advocating for changes in governance, transparency, and social justice."
Politics,"The government is addressing criticisms of recent foreign policy actions. Officials are defending their strategies and outlining future plans to enhance international relations."
Politics,"International organizations are weighing in on global political developments. Reports and statements from these entities are influencing public opinion and policy decisions."
Politics,"New political alliances are being formed in response to shifting global dynamics. Countries are aligning based on mutual interests and strategic goals to address common challenges."
Politics,"Political leaders are emphasizing the importance of unity and national stability. Efforts are being made to bridge divides and foster cooperation among different groups."
Politics,"Recent political events are sparking debates about democratic values. Discussions are focusing on issues like freedom of speech, electoral integrity, and civil liberties."
Politics,"The government has outlined plans for addressing emerging geopolitical threats. Strategies include strengthening defense capabilities, enhancing intelligence operations, and building alliances."
Politics,"International observers are reporting on the integrity of recent elections. Their findings are contributing to discussions about electoral reforms and democratic practices."
Politics,"Political activists are advocating for reforms in the criminal justice system. Efforts include addressing systemic issues, reducing incarceration rates, and promoting rehabilitation programs."
Politics,"The government is seeking to balance economic growth with environmental protections. Policies are being developed to support sustainable development and mitigate the impact of industrial activities."
Politics,"The political landscape is shifting with new leadership in key regions. Changes in governance are expected to impact local policies and development strategies."
Politics,"Public reactions to political decisions are reflecting growing concerns about governance. Citizens are expressing their views through protests, social media, and community meetings."
Politics,"Diplomatic efforts are focusing on resolving ongoing conflicts and disputes. Negotiations and peace talks are being held to address issues and foster cooperation."
Politics,"The legislative body is considering new regulations to address emerging issues. Lawmakers are debating policies related to technology, healthcare, and the environment."
Politics,"Political commentators are analyzing recent developments and future trends. Their insights are helping the public understand the implications of current events and policy decisions."
Politics,"The government is introducing measures to enhance transparency and accountability. Initiatives include open data platforms, public reporting, and independent audits."
Politics,"Political leaders are engaging in dialogue to address cross-border challenges. Discussions are focusing on issues like trade, security, and climate change."
Politics,"The legislative body is working on comprehensive reforms in various sectors. The aim is to modernize regulations, improve efficiency, and address contemporary challenges."
